{
  "schema_version": "1.0.0",
  "procurement_plan_id": "pproc_consultco_v1",
  "request_id": "req_demo",
  "decision_id": "dec_consultco_v1",
  "version": 1,
  "gates": [
    { "gate_id": "pg_privacy", "kind": "current_privacy_evidence", "status": "PASSED", "owner_role": "security_privacy_owner", "evidence_ids": ["ev_fixture_d_product"] },
    { "gate_id": "pg_dpa", "kind": "dpa_terms", "status": "PASSED", "owner_role": "legal_owner", "evidence_ids": ["ev_fixture_d_product"] },
    { "gate_id": "pg_merchant", "kind": "merchant_chain", "status": "PASSED", "owner_role": "platform_operator", "evidence_ids": ["ev_fixture_d_merchant"] },
    { "gate_id": "pg_billing", "kind": "billing_cost_center", "status": "PASSED", "owner_role": "budget_owner", "evidence_ids": ["ev_fixture_d_merchant"] },
    { "gate_id": "pg_budget", "kind": "budget_approval", "status": "PASSED", "owner_role": "budget_owner", "evidence_ids": ["ev_fixture_d_product"] },
    { "gate_id": "pg_deployment", "kind": "deployment_owner", "status": "PASSED", "owner_role": "operations_owner", "evidence_ids": ["ev_fixture_d_product"] }
  ],
  "evaluated_at": "2026-08-02T01:09:00Z",
  "gate_result_hash": "sha256:2553b3d2be3b1a3066e4a5ebfe0772ee80c821c6fa04b56517ae21fadcd01acc"
}
